<?xml version="1.0" encoding="UTF-8"?>
<books xmlns:xsi="http://www.w3.org/2001/XMLSchema-instance" xsi:noNamespaceSchemaLocation="att-book.xsd">
    <book id="wew">
        <name></name>
        <author title="ms">
            <first></first>
            <middle></middle>
            <last></last>
        </author>

        <isbn>1111111111111</isbn>
        <publisher></publisher>
        <edition>1221</edition>
        
        <price currency="usd">899</price>
    </book>


</books>

<!-- 10.Write XML Schema and prepare file, which will display the Book
information. It includes the following
 Title of the book
 Multiple Author Name with details(first, middle, last) name
 ISBN number (consists of 13 digit)
 Publisher name
 Edition
 Price(price limit is upto 1000
 Book has book id attribute
 Author has title attribute with (mr,ms,mrs) value and default ms
 Price has currency attribute with default value "npr" -->